upc,title,description,image_url,product_url
714043010918,NO STRESS CHESS®,"Unlike any other Chess teacher, No Stress Chess teaches you how to play using illustrated cards and an illustrated 2-sided board.",https://winning-moves.com/images/1087_payday2024_sml.jpg,https://winning-moves.com/product/NoStressChess.asp
714043012172,MONOPOLY® SCRABBLE®,Experience the totally unique gameplay of Monopoly® Scrabble®— the innovative game that combines the best elements of the Monopoly® game with the crossword-building play of Scrabble®.,,https://winning-moves.com/product/monopolyscrabble.asp
714043012516,BOGGLE® JR. NUMBERS,Children love to count and they love to learn! With Boggle Jr. Numbers they'll combine the two as they play these enriching numbers games!,,https://winning-moves.com/product/bogglejrnumbers.asp
71404301250,MONOPOLY® SCRABBLE®,Experience the totally unique gameplay of Monopoly® Scrabble®— the innovative game that combines the best elements of the Monopoly® game with the crossword-building play of Scrabble®.,,https://winning-moves.com/product/monopolyscrabble.asp
714043012608,THAT COLOR SPEAKS TO ME®,Stay up to date on the latest news from Winning Moves Games by signing up for our Newsletter!,https://winning-moves.com/images/1260_TCSTM_largeV2.jpg,https://winning-moves.com/product/ThatColorSpeaksToMe.asp
714043012615,BOGGLE® JR. NUMBERS,Children love to count and they love to learn! With Boggle Jr. Numbers they'll combine the two as they play these enriching numbers games!,,https://winning-moves.com/product/bogglejrnumbers.asp
714043011991,PASS THE PIGS®,Celebrating more than 40 years of Pig-tastic fun! Rack up points by rolling the pig-dice but be careful not to ''Pig Out.'' A classic party game enjoyed by Oscar nominated star Jeff Bridges!,https://winning-moves.com/images/PTP_PART_2017_small.jpg,https://winning-moves.com/product/PassThePigs.asp
